{
  "schema_id": "roboticsbenchmarks.seed/v1",
  "schema_version": "1.0.0",
  "generated_at": "2026-08-20T08:51:45Z",
  "evidence_cutoff": "2026-08-20",
  "source_packet": {
    "file_name": "RoboticsBenchmarks.com_MVP_Product_Specification.docx",
    "sha256": "e7c7496bd618afe8095e8561993cdec6775fc9cd80f0a784fda8e221c0fa7f48",
    "canonical_sections": ["10", "11", "12", "17", "25", "29", "30", "Appendix A"]
  },
  "import_contract": {
    "mode": "draft_only",
    "is_demo_default": false,
    "publication_status_default": "draft",
    "requires_claim_source_binding": true,
    "requires_launch_day_url_check": true,
    "requires_human_approval_to_publish": true,
    "forbid_unscoped_metrics": true,
    "forbid_composite_rankings": true,
    "on_validation_error": "abort_entire_import"
  },
  "records": [
    {
      "slug": "open-x-embodiment",
      "canonical_name": "Open X-Embodiment",
      "entity_kind": "dataset_resource",
      "primary_domain": "manipulation",
      "evaluation_settings": ["real_robot"],
      "scope_summary": "Open dataset collection and RT-X cross-embodiment research ecosystem; it is not one fixed benchmark.",
      "primary_metric_summary": {
        "state": "not_defined",
        "name": null,
        "note": "RT-X experimental success rates belong to named protocols and must not be displayed as a universal Open X-Embodiment score."
      },
      "official_url": "https://robotics-transformer-x.github.io/",
      "paper_url": "https://arxiv.org/abs/2310.08864",
      "code_url": "https://github.com/google-deepmind/open_x_embodiment",
      "verification_state": "verified",
      "verification_note": "Identity and scope are verified; current lifecycle remains unknown without a current official release statement.",
      "source_verified_on": "2026-08-20",
      "publication_status": "draft",
      "is_demo": false,
      "source_ids": ["S01", "S02", "S03"],
      "claims": [
        {
          "claim_key": "identity",
          "value": "Dataset/resource and cross-embodiment research ecosystem, not a single benchmark.",
          "source_ids": ["S01", "S02"]
        },
        {
          "claim_key": "scope",
          "value": "Official materials describe more than one million real-robot trajectories across 22 embodiments, pooled from 60 datasets and 34 labs.",
          "source_ids": ["S01", "S02"]
        }
      ]
    },
    {
      "slug": "libero",
      "canonical_name": "LIBERO",
      "entity_kind": "benchmark_suite",
      "primary_domain": "manipulation",
      "evaluation_settings": ["simulation"],
      "scope_summary": "Lifelong robot-learning benchmark with four suites and 130 tasks.",
      "primary_metric_summary": {
        "state": "defined",
        "metric_id": "met_libero_fwt",
        "name": "Forward Transfer",
        "protocol_id": "pro_libero_lifelong_default",
        "direction": "higher_is_better"
      },
      "other_metrics": [
        {
          "metric_id": "met_libero_nbt",
          "name": "Negative Backward Transfer",
          "protocol_id": "pro_libero_lifelong_default",
          "direction": "lower_is_better"
        },
        {
          "metric_id": "met_libero_auc",
          "name": "Area under the success-learning sequence",
          "protocol_id": "pro_libero_lifelong_default",
          "direction": "higher_is_better"
        }
      ],
      "official_url": "https://libero-project.github.io/main.html",
      "paper_url": "https://arxiv.org/abs/2306.03310",
      "code_url": "https://github.com/Lifelong-Robot-Learning/LIBERO",
      "verification_state": "verified",
      "verification_note": "Store paper revision, repository/data version, task order, and checkpoint protocol with results.",
      "source_verified_on": "2026-08-20",
      "publication_status": "draft",
      "is_demo": false,
      "source_ids": ["S04", "S05", "S06"],
      "claims": [
        {
          "claim_key": "identity",
          "value": "Lifelong robot-learning benchmark for knowledge transfer.",
          "source_ids": ["S04", "S05"]
        },
        {
          "claim_key": "scope",
          "value": "Four suites and 130 tasks: LIBERO-Spatial, LIBERO-Object, LIBERO-Goal, and LIBERO-100.",
          "source_ids": ["S05"]
        },
        {
          "claim_key": "metrics",
          "value": "Forward Transfer, Negative Backward Transfer, and area under the success-learning sequence under the declared lifelong-learning protocol.",
          "source_ids": ["S05"]
        }
      ]
    },
    {
      "slug": "rlbench",
      "canonical_name": "RLBench",
      "entity_kind": "benchmark_suite",
      "primary_domain": "manipulation",
      "evaluation_settings": ["simulation"],
      "scope_summary": "Robot-learning benchmark and environment with 100 hand-designed tasks, variations, demonstrations, and multimodal observations.",
      "primary_metric_summary": {
        "state": "defined",
        "metric_id": "met_rlbench_task_success_rate",
        "name": "Task success rate",
        "protocol_id": "pro_rlbench_declared_task_set",
        "direction": "higher_is_better",
        "note": "Interpret the task success rate only within the declared task set and evaluation protocol."
      },
      "official_url": "https://sites.google.com/view/rlbench",
      "paper_url": "https://arxiv.org/abs/1909.12271",
      "code_url": "https://github.com/stepjam/RLBench",
      "verification_state": "verified",
      "verification_note": "Classification and metric are verified; maintenance recency is tracked separately.",
      "source_verified_on": "2026-08-20",
      "publication_status": "draft",
      "is_demo": false,
      "source_ids": ["S07", "S08", "S09"],
      "claims": [
        {
          "claim_key": "scope",
          "value": "Official materials describe 100 hand-designed tasks with variations, motion-planned demonstrations, and multimodal observations.",
          "source_ids": ["S07", "S08"]
        },
        {
          "claim_key": "metric",
          "value": "Each task exposes sparse completion reward: +1 only when the task is completed.",
          "source_ids": ["S08", "S09"]
        }
      ]
    },
    {
      "slug": "robotperf",
      "canonical_name": "RobotPerf",
      "entity_kind": "benchmark_suite",
      "primary_domain": "systems_compute",
      "evaluation_settings": ["compute_only"],
      "scope_summary": "Open reference robotics-computing benchmark suite using ROS 2 as a common baseline across multiple workload and hardware categories.",
      "primary_metric_summary": {
        "state": "multiple",
        "name": null,
        "note": "RobotPerf reports workload-scoped measures with their units and measurement methods."
      },
      "other_metrics": [
        {"name": "Latency", "protocol_scope": "workload_specific"},
        {"name": "Reaction time", "protocol_scope": "workload_specific"},
        {"name": "Throughput or bandwidth", "protocol_scope": "workload_specific"},
        {"name": "Power", "protocol_scope": "workload_specific"},
        {"name": "Performance per watt", "protocol_scope": "workload_specific"},
        {"name": "Memory", "protocol_scope": "workload_specific"}
      ],
      "official_url": "https://robotperf.net/",
      "paper_url": "https://arxiv.org/abs/2309.09212",
      "code_url": "https://github.com/robotperf/benchmarks",
      "metric_spec_url": "https://github.com/robotperf/benchmarks/blob/main/benchmarks/README.md",
      "verification_state": "verified",
      "verification_note": "Each metric must preserve the applicable workload, unit, and measurement method.",
      "source_verified_on": "2026-08-20",
      "publication_status": "draft",
      "is_demo": false,
      "source_ids": ["S10", "S11", "S12", "S13"],
      "claims": [
        {
          "claim_key": "identity",
          "value": "Open reference robotics-computing benchmark suite using ROS 2 as a common baseline.",
          "source_ids": ["S10", "S11"]
        },
        {
          "claim_key": "metric_model",
          "value": "Benchmark results record workload-scoped metrics such as latency, throughput, and power.",
          "source_ids": ["S12", "S13"]
        }
      ]
    },
    {
      "slug": "robochallenge-table30",
      "canonical_name": "RoboChallenge Table30",
      "aliases": ["RoboChallenge", "Table30"],
      "entity_kind": "challenge",
      "primary_domain": "manipulation",
      "evaluation_settings": ["real_robot"],
      "scope_summary": "Real-robot tabletop benchmark suite on the RoboChallenge.ai evaluation platform; Table30v2 is modeled as a versioned child.",
      "primary_metric_summary": {
        "state": "defined",
        "metric_id": "met_table30_task_success_rate",
        "name": "End-to-end task success rate",
        "protocol_id": "pro_table30_original",
        "direction": "higher_is_better"
      },
      "other_metrics": [
        {
          "metric_id": "met_table30_staged_progress",
          "name": "Staged progress score",
          "protocol_id": "pro_table30_original",
          "direction": "higher_is_better"
        }
      ],
      "official_url": "https://robochallenge.ai/",
      "challenges_url": "https://robochallenge.ai/challenges",
      "paper_url": "https://arxiv.org/abs/2510.17950",
      "code_url": "https://github.com/RoboChallenge/RoboChallengeInference",
      "data_url": "https://huggingface.co/datasets/RoboChallenge/Table30v2",
      "verification_state": "verified",
      "verification_note": "Canonicalized from the ambiguous bare name RoboChallenge; alias search must disambiguate unrelated competitions.",
      "source_verified_on": "2026-08-20",
      "publication_status": "draft",
      "is_demo": false,
      "source_ids": ["S14", "S15", "S16", "S17", "S18"],
      "claims": [
        {
          "claim_key": "identity",
          "value": "RoboChallenge.ai is the platform; Table30 is the real-robot benchmark suite.",